{
  "schema_version": "1.0",
  "adapter": "opencode",
  "binding_version": "1.0.0",
  "bindings": [
    {
      "skill_id": "backend-change",
      "path": ".opencode/skills/backend-change/SKILL.md",
      "expected_sha256": "e8c8600a88c8003c37e3f49435e7c79bbfaa2ed56b17d9954f81ba892fb7e2b0"
    },
    {
      "skill_id": "database-change",
      "path": ".opencode/skills/database-change/SKILL.md",
      "expected_sha256": "ffcdacd803a2a7d520697ed1bedb9ba159db32e4092c2f7d94d230dbd3e76c04"
    },
    {
      "skill_id": "diff-review",
      "path": ".opencode/skills/diff-review/SKILL.md",
      "expected_sha256": "2363ceb7a0371838995a6166563eff47e2a949e912c4915e7e412e239d81667d"
    },
    {
      "skill_id": "frontend-change",
      "path": ".opencode/skills/frontend-change/SKILL.md",
      "expected_sha256": "6a813f5b11498c0de7ff2dd5d656dcf6ece23141e6d7b2704b72cf8793625e80"
    },
    {
      "skill_id": "implementation-plan",
      "path": ".opencode/skills/implementation-plan/SKILL.md",
      "expected_sha256": "1f3cfe340226f11bd674dbd86f8f6bf86e258879ced0c1ddff6befc5f8b8fa62"
    },
    {
      "skill_id": "regression-analysis",
      "path": ".opencode/skills/regression-analysis/SKILL.md",
      "expected_sha256": "04f08a6b388b40d3c40426cc984e08af059adf7a4671d76d4ff6f0457da57b36"
    },
    {
      "skill_id": "repair-loop",
      "path": ".opencode/skills/repair-loop/SKILL.md",
      "expected_sha256": "e69f0b06591fef44f716486ab885d3bd8adfa5ced1b94f82a03e14d34b1b069e"
    },
    {
      "skill_id": "repo-map",
      "path": ".opencode/skills/repo-map/SKILL.md",
      "expected_sha256": "89d7e2c86a7f7bd0f769876c243cc95d58016cc7590def6e2cab8f68b377d805"
    },
    {
      "skill_id": "requirements-check",
      "path": ".opencode/skills/requirements-check/SKILL.md",
      "expected_sha256": "72162421a04f4d02261bc23c203158daadcb990b4b059bfcf6af94a55dff826f"
    },
    {
      "skill_id": "safe-edit",
      "path": ".opencode/skills/safe-edit/SKILL.md",
      "expected_sha256": "3b82886968baadbb074b9a434eb67b2d80159379f392bb96d4593d1d42ce6765"
    },
    {
      "skill_id": "security-check",
      "path": ".opencode/skills/security-check/SKILL.md",
      "expected_sha256": "c9ef94a26611bd71d83261b21ccff39c509e915701648d8433fbb440c9bcf830"
    },
    {
      "skill_id": "task-contract",
      "path": ".opencode/skills/task-contract/SKILL.md",
      "expected_sha256": "0d741f9b981ff513a1442920a7f5605e90dc470b1355c1d695ee7ed0de1e09fc"
    },
    {
      "skill_id": "test-strategy",
      "path": ".opencode/skills/test-strategy/SKILL.md",
      "expected_sha256": "45c6552478fa00a208d303beb19b715ee73ada73f01ab860007feb595c2b9928"
    }
  ]
}
