{
  "schema_version": "1.0",
  "adapter": "codex",
  "binding_version": "1.0.0",
  "bindings": [
    {
      "skill_id": "backend-change",
      "path": ".agents/skills/backend-change/SKILL.md",
      "expected_sha256": "d7e1ad66c4355777a028986f0b07ae64eccf4e132f8676c53d73f5193983bca8"
    },
    {
      "skill_id": "database-change",
      "path": ".agents/skills/database-change/SKILL.md",
      "expected_sha256": "88c86a5f16480d3767d588480c749844b6492c1d83b125957894953a8575a4f3"
    },
    {
      "skill_id": "diff-review",
      "path": ".agents/skills/diff-review/SKILL.md",
      "expected_sha256": "50f6b7f5bd6845a9dfeb2cfdc38a9a91eaefdaefc8609b50ad3ea3937d3844ec"
    },
    {
      "skill_id": "frontend-change",
      "path": ".agents/skills/frontend-change/SKILL.md",
      "expected_sha256": "477fe3ed070f3a732f9e8c5a7336d7b24068f4714fa987bfa77b97c9a2481466"
    },
    {
      "skill_id": "implementation-plan",
      "path": ".agents/skills/implementation-plan/SKILL.md",
      "expected_sha256": "f58994ca99ad8eaff38c4ea6f672bc7fcc458e7a1975b0486fbf9cac5bfbbea3"
    },
    {
      "skill_id": "regression-analysis",
      "path": ".agents/skills/regression-analysis/SKILL.md",
      "expected_sha256": "aaeb3c6a06742eb21c75b6ce3f41216c0c3b179b25b0fd260d1e0bf0fd4c99b6"
    },
    {
      "skill_id": "repair-loop",
      "path": ".agents/skills/repair-loop/SKILL.md",
      "expected_sha256": "5df8564c2d924e8d9526f5e9b8326af107fd86664c1af27d351bf39b1196647a"
    },
    {
      "skill_id": "repo-map",
      "path": ".agents/skills/repo-map/SKILL.md",
      "expected_sha256": "173841b2ba551c7f4ed97506655e0fc4cb8a141216264eb6cc5771e067c3643b"
    },
    {
      "skill_id": "requirements-check",
      "path": ".agents/skills/requirements-check/SKILL.md",
      "expected_sha256": "6b165a1eb444009e054ed420a3a6b22383d7699aaccc7d8cb667519e87c63806"
    },
    {
      "skill_id": "safe-edit",
      "path": ".agents/skills/safe-edit/SKILL.md",
      "expected_sha256": "77743dd543213a631ffcc0aa52678045a2d2783b0ef717cb3d89060789bf698f"
    },
    {
      "skill_id": "security-check",
      "path": ".agents/skills/security-check/SKILL.md",
      "expected_sha256": "38d30a336e05ee3faa891a04a8e7be2939fea06e5806130f56411960d64035bc"
    },
    {
      "skill_id": "task-contract",
      "path": ".agents/skills/task-contract/SKILL.md",
      "expected_sha256": "a9af53dfdd7143c6071f6409c5950f15e4fe2418e8d7fb664923016541ae5ba9"
    },
    {
      "skill_id": "test-strategy",
      "path": ".agents/skills/test-strategy/SKILL.md",
      "expected_sha256": "0c272ea0dc3c45da2cbe7766ec16d03b67f91ac17d1435858fc9e95badd624aa"
    }
  ]
}
